{
  "meta": {
    "schema_version": "1.6.0",
    "tracking_issue": 123,
    "status": "active",
    "phase": "phase-0"
  },
  "policy_sources": [
    {
      "id": "plugin-manifest",
      "path": "plugin.json",
      "format": "json",
      "authority": "name/version/description/author/homepage/repository/license single source of truth for the gitapex plugin's identity; .claude-plugin/plugin.json is mechanically generated from it (see plugin-manifest-mirror-drift), and apm.yml mirrors name/version from that generated copy (see apm-manifest-drift)"
    },
    {
      "id": "claude-plugin-manifest",
      "path": ".claude-plugin/plugin.json",
      "format": "json",
      "authority": "Generated mirror of the repository-root plugin.json (see plugin-manifest-mirror-drift); authoritative only for apm-manifest-drift's own name/version comparison against apm.yml"
    },
    {
      "id": "agent-plugins-plugin-schema",
      "path": ".gitapex/agent-plugins-plugin.schema.json",
      "format": "json",
      "authority": "Agent Plugins Specification (agent-plugins.org) v1.0.0's plugin.json JSON Schema, vendored verbatim at agentplugins/agent-plugins-spec commit bd383552095128f6effe895b9257cfd580a6d179 (no tag/release exists upstream as of this pin) -- authoritative shape for the repository-root plugin.json, read by plugin-manifest-schema-conformance"
    },
    {
      "id": "pyproject-coverage",
      "path": "pyproject.toml",
      "format": "toml",
      "authority": "[tool.coverage.run] source directories -- authoritative scope for evals-scripts-coverage-floor's per-file coverage check"
    },
    {
      "id": "pyproject-ruff",
      "path": "pyproject.toml",
      "format": "toml",
      "authority": "[tool.ruff] target-version/line-length and [tool.ruff.lint] select/ignore/per-file-ignores -- the authoritative rule set for python-lint, ported from upstream tvna/claude-md; the ruff version itself is pinned in [dependency-groups] dev and resolved through uv.lock"
    },
    {
      "id": "skill-metadata-sidecar",
      "path": "skills/*/metadata/gitapex.yaml",
      "format": "yaml",
      "authority": "per-skill capabilityAssumption (read by routine-scope-enforcement), spec.lifecycle.renamedFrom (read by skill-rename-lifecycle), and the full document shape (read by skill-metadata-schema-drift against skills/evaluating-skill-quality/references/skill-metadata.schema.json); one entry stands in for the glob since every sidecar shares one schema"
    },
    {
      "id": "pyproject-mypy-config",
      "path": "pyproject.toml",
      "format": "toml",
      "authority": "[tool.mypy] strict-by-default config plus the named Tier A/B/C per-module override allowlist (each override citing issue #684 or a dedicated follow-up tracking reference) -- authoritative scope/strictness for mypy-type-check"
    },
    {
      "id": "runtime-compatibility-matrix",
      "path": ".gitapex/runtime-compatibility-matrix.json",
      "format": "json",
      "authority": "Versioned, testable record of how faithfully each target agent-tool runtime can enforce the ten W2 execution-requirement dimensions (parent issue #307); authoritative source for a future W4 enforcement adapter, not yet consumed by any gate"
    },
    {
      "id": "waza-suite-schemas",
      "path": ".gitapex/waza-eval.schema.json",
      "format": "json",
      "authority": "waza's own eval/task JSON Schemas (draft-07, as upstream declares them), vendored verbatim at the release tag recorded in gitapex_scan_eval_suite_schema.py's VENDORED_WAZA_TAG (waza's own binary retired per issue #1130/#1136; this tag now records only the vendored schemas' provenance) -- authoritative shape for every committed evals/ suite, read by eval-suite-schema-drift. One entry stands in for the pair: .gitapex/waza-task.schema.json is vendored from the same tag by the same gate and carries the same authority"
    },
    {
      "id": "main-branch-ruleset",
      "path": ".github/rulesets/main.json",
      "format": "json",
      "authority": "The GitHub Repository Ruleset this repository intends to enforce on its default branch -- name/target/enforcement/conditions/bypass_actors/rules, i.e. exactly the key set GitHub's own ruleset POST/PUT body accepts. Authoritative for what protection main is supposed to carry (read by both scopes of the ruleset-verify workflow, written to GitHub only by the human-dispatched apply-rulesets workflow, which stays a separate file so the write-capable Environment binding is greppable rather than expression-derived); it is NOT proof that GitHub enforces it, which is why both reading gates exist"
    },
    {
      "id": "eval-run-record-schemas",
      "path": "skills/scorer-gated-skill-edits/references/eval-run.schema.json",
      "format": "json",
      "authority": "Shape of a scorer-gated-skill-edits gate-run record, read by eval-results-schema-drift. Authored inside the owning skill (issue #932) rather than in .gitapex/, so the contract travels with SKILL.md when the skill is installed elsewhere. One entry stands in for the pair: skills/scorer-gated-skill-edits/references/eval-scores.schema.json sits in the same directory, ships with the same skill, and is authoritative the same way for each per-model score file a gate-run record points at"
    },
    {
      "id": "eval-model-allowlist",
      "path": ".gitapex/eval-model-allowlist.yaml",
      "format": "yaml",
      "authority": "The reviewed approved_models/retired_models mappings gitapex_gate_eval_declared_model.py grades every committed model identifier against (issue #925). A model id may be committed only if it appears under approved_models, each row carrying the evidence a human weighed when approving it; retired_models exists purely to turn the most likely failure into a specific message. Externalized from the gate script's own hardcoded dict literals (issue #1013) -- pointing this entry directly at the script's module-level constants instead was considered and rejected: policy_sources[].format's enum (toml/json/yaml/rego/markdown) has no way to name a Python source file's own constants"
    },
    {
      "id": "grounding-in-primary-sources-skill",
      "path": "skills/grounding-in-primary-sources/SKILL.md",
      "format": "markdown",
      "authority": "The authoring-time discipline for grounding a durable claim (a version number, a feature's support status, a specific count, \"always\"/\"never\"/\"the only cause\") in a primary source before stating it as Fact rather than Speculation -- for an external tool/library/API/platform claim, and (since issue #1890) for a durable claim about this repository's own code. No gate script consumes this entry: it is read directly by an agent following merge-retrospective's Repair record format section or drafting-issues's own Facts step (issue #1890), which each point here rather than duplicating the procedure. The first policy_sources entry with no consuming gate at all -- format's markdown value (added this same change) exists for exactly this case, a prose policy an agent reads rather than a script parses."
    },
    {
      "id": "blocking-advisory-severity-drafting-a-pr-to-merge",
      "path": "skills/drafting-a-pr-to-merge/SKILL.md",
      "format": "markdown",
      "authority": "The Blocking/Advisory finding-severity vocabulary and stopping rule drafting-a-pr-to-merge's own Step 8 applies to a confirmed finding from either of its two review layers (issue #1943): Blocking (must-fix, loops back to step 3 by default, subject to the stopping rule) versus Advisory (worth-noting, disclosed only, does not by itself trigger a loop-back). No gate script consumes this entry: the classification is judged inline, by drafting-a-pr-to-merge's own thread reading a finding's substance, never a structured field either review layer's own report carries. Follows the same no-consuming-gate precedent issue #1890 already established for the grounding-in-primary-sources-skill entry above, rather than duplicating the procedure."
    },
    {
      "id": "blocking-advisory-severity-executing-a-branch-plan",
      "path": "skills/executing-a-branch-plan/SKILL.md",
      "format": "markdown",
      "authority": "The Blocking/Advisory finding-severity vocabulary and stopping rule executing-a-branch-plan's own Step 8 applies to a CONFIRMED finding from either of its two dispatches (issue #1946): the refactor/simplify pass's own item routed onward as behavior-affecting, or the review-persona adversarial-review pass's own finding. Blocking (must-fix, loops back within step 8 by default, subject to the same-finding-class 2-consecutive-round stopping rule) versus Advisory (disclosed in the PR body only, does not by itself trigger a further round). No gate script consumes this entry: the classification is judged inline, by this step's own thread reading a finding's substance, never a structured field either dispatch's own report carries. Follows the same no-consuming-gate precedent issue #1890 already established for the grounding-in-primary-sources-skill entry above, and the same shape as the sibling blocking-advisory-severity-drafting-a-pr-to-merge entry (issue #1943), rather than duplicating either procedure."
    }
  ],
  "gates": [
    {
      "id": "bash-cli-write-and-install-guard",
      "kind": "script",
      "script": "hooks/check-bash-safety.sh",